sample_id,target_duration,actual_duration,start_time,end_time,word_count,text
sample_049,34.13,32.96,1623.67,1656.63,144,"Mm-hmm and Mm-hmm if you . like Yeah . . get the instruction manual that comes with it and you just don't even read it then you'll never even know that those things can pull out Mm-hmm . And you're a happy . person and everyone else doesn't have to have like two remotes one , that has the easy ones and one that has Yeah more complicated Yeah Mm-hmm . ones , that's . a good , but idea 's all still I think . in that's one a good idea . yeah , . Mm . Um we have to be careful that that that doesn't impede um the chip transmitting information Yeah . , but Good Yeah um point . that's gonna be mostly technological thing . Yeah . Um . . Okay um , so what are we emphasising ?"
sample_050,21.47,21.05,982.46,1003.51,70,"happen through the chip that controls that converts the electrical energy into data , which then goes through the infra-red so , the the chip that uh I think Ian is designing , is gonna be crucial . And really it all comes down to the to the user , because they're the one that's controlling most of the working design . So the components that we find here are"
sample_051,48.94,48.4,3317.34,3365.74,139,"then the fashion watch talks about that this year's top trend for clothes , shoes and furniture is fruits and vegetables and tha that there's a preference S sweet for spongy . , tight material . And so that brings us to my personal preferences . Who wants a spongy remote or one with fruit and vegetable padding Personally . , I don't really think that I want one that's gonna go out of style or go stale , excuse the pun , um in a year , so even though this is coming from us as , you know , trend watch , market research , I don't know how much of it we necessarily wanna take away . Also considering , that the d research b has been carried out by Real Reaction , I'm a little"
sample_052,42.13,42.02,6680.4,6722.42,127,", that's what I do and so I had it once , even if it was just like the title of it , like the three presentations , and I would do your Right three . . You have you have to have the slogan on it or can it just be like The slogan No on it , no ? No definitely , no Okay no good not . . . We 'Cause I was like , it could go around the outside No , I don't . think we need to I I think think we just the need R_ the and R_ um especially , the R_R_ if yeah , the yellow . and black one . Is it yellow and blue ? Or"
sample_053,47.88,47.58,1640.8,1688.38,151,"Um we have to be careful that that that doesn't impede um the chip transmitting information Yeah . , but Good Yeah um point . that's gonna be mostly technological thing . Yeah . Um . . Okay um , so what are we emphasising ? I what in this Si project ? simplicity and fashion I think . simplicity Simplicity Yeah and fashion , fashion . . mm . Okay those , are very good goals I , think , um that we have to keep in mind in with everything we do Simplicity . and fashion and , yeah or , usability speci however you wanna say that which , includes um an emphasis on making the infra-red very functional Mm-hmm so , that you . don't Yeah have . to travel around a lot . Yeah . What can Um you do . to like make the infra-red"
sample_054,46.32,45.97,4555.76,4601.73,169,", and then to choose what colours we want to make the buttons and if we wanna put any text on the device , like label on the buttons or put a brand name or or Mm-hmm a logo on it or whatever . . We were we were thinking that normally we'd go for fruity colours , but maybe we're also thinking that your sort of middle aged man for , an example customer might , not want a fruity coloured remote , so m maybe we'd have one version that's a bit toned down Mm 'kay maybe , . with with less contrasts on it Yeah . Would something , still a little bright to make it Yeah hard to lose but , , but we don't want it to look like a kids' toy . yeah . Now that was one thing that we brought up over email . I don't know if you picked up your email Yeah but , . um the f the"
sample_055,35.93,35.18,5162.69,5197.87,166,", one Yeah that's but , if more you had fruity like a silvery . kind of white or something Yeah . . Yeah , Um and If can we we had have a yellow like an R_R_ inscribed on the bottom or something Sure . Okay ? Oh Yeah . . , yeah . Alright so , Fruity So I think it it so , it's fruity was inspired . by the potato so , I think Yeah it's . pretty I fruity think i . it's kind of mangoey too . Yeah Oh Mangoey , mango I . is okay better Yes yeah , , that I'm giving . . I it a one that the mango like mangoes put me over . Mm That's . a much more trendy than a potato . What are what's everyone's numbers ? one . Uh two . One . Alright um and , does the design match the appropriate behaviour ? Remember earlier we discussed that"
sample_056,47.27,45.99,1610.64,1656.63,199,"complicated like programme your television or re-tune it then , you you open up this little hatch or or slide Mm-hmm the screen down . and there's all Mm-hmm the all the . special buttons 'Cause . then 's like people who don't wanna ever look at them never , even have to see them Mm-hmm and Mm-hmm if you . like Yeah . . get the instruction manual that comes with it and you just don't even read it then you'll never even know that those things can pull out Mm-hmm . And you're a happy . person and everyone else doesn't have to have like two remotes one , that has the easy ones and one that has Yeah more complicated Yeah Mm-hmm . ones , that's . a good , but idea 's all still I think . in that's one a good idea . yeah , . Mm . Um we have to be careful that that that doesn't impede um the chip transmitting information Yeah . , but Good Yeah um point . that's gonna be mostly technological thing . Yeah . Um . . Okay um , so what are we emphasising ?"
sample_057,18.1,17.77,4935.62,4953.39,52,"know if it meets the fancy look and feel um objective . So like in my opinion the for now at least , the yellow one is probably somewhere in the middle so I'm gonna say it's like a three That's . just my opinion . Yeah . What does each of"
sample_058,21.86,21.41,2492.8,2514.21,75,"of a scroll scroll Mm wheel . if , anyone has anything any ideas on that ? I mean I know the iPods and things right now have touch scroll um buttons which are exactly like what they're describing , so that might be something we wanna look into . And I'm really intrigued by the idea of a kinetic battery . Solar I don't think would be such a good idea , because how"
sample_059,16.58,15.32,4285.68,4301.0,44,"battery um , we want to use a simple chip , because we're not gonna need a a shuffle um we're , gonna need a scroll um , we're choosing a latex case w in fruity colours that's curved and um we're using push"
sample_060,26.39,26.18,4293.84,4320.02,66,"a latex case w in fruity colours that's curved and um we're using push buttons uh with a supplement of an on-screen menu . And it sounded like we had set um like eight or nine buttons , including five pre-set channels . Okay Let's ? do the look and feel design presentation first . Right , do you wanna start ? Right well , we"
sample_061,28.6,27.7,3631.31,3659.01,137,"menu and like , I dunno if we would want it on the screen there or on the actual T_V_ I . kind of am wanting Yeah to say . on the T_V_ 'cause , if you're changing Hmm the . brightness , don't you wanna see it happening , kind Mm of Yeah . . Yeah . And ? then Yeah , I you think could still an have L_C_D_ that available screen . might be good in theory but , not as useful I think in it practice could be difficult . in practice , yeah Yeah . . Also z yeah , 'cause you would be z looking down at the L_C_D_ screen Mm-hmm , than Right back up . at your T_V_ and Mm-hmm . . people Um don't wanna do that ."
sample_062,24.5,24.25,612.0,636.25,76,"remember that remote controls are a a fairly standard piece of equipment . When a users using a remote control he , or she expects the buttons to be in certain places . So in some sense we're gonna we're gonna have to aim for a device which is fairly conventional in design uh so that we're not completely shocking people But . I think within that there is also room for us to introduce novel"
sample_063,44.01,43.63,5661.38,5705.01,158,"think so . I think they're if they're all Okay gonna . be rubber then it that's what it matters . Yeah , 'cause it Yeah wouldn't make sense . Yeah otherwise 'cause , for . the whole mat case material it's only one Mm-hmm Yeah . . . It's I mean it's two to make it rubber Okay . Oh . wait so , maybe . Thirteen point seven . Oh oh . Yeah , what can we reduce Okay , let's ? have our buttons all be one colour . Mm I , kind of like Let's the see buttons what that would do . It's . only gonna bring us down to thirteen point three anyway . Alright . Okay um Uh are , we . sure this is double-curved ? Maybe it's single-curved We have no idea . we , have no idea . I dunno , I didn't get any pictures . It's"
sample_064,27.49,26.34,2175.13,2201.47,33,Okay Well . I'll figure that out in the meantime . Okay . Okay . Okay . Mm-hmm . Mm yeah . Okay . I g yeah . Time is it ? Fourteen
sample_065,24.83,24.74,1264.2,1288.94,90,"a hundred on your remote control and this this kind of index appears on the television screen with just some some text and some very blocky looking graphics on it . And you just type numbers to go to different pages and it gives you information , mostly rather boring S stuff like what's on T_V_ next and share prices and that kind of thing . Lottery numbers and sport scores Yep . , news headlines But . if you ever see the T_V_ saying like go to page one"
sample_066,33.99,33.18,276.69,309.87,92,"with voice recognition whereas , the older people in the like sixty and above segment or so did not really think that they would pay more money for voice recognitions . Um 'Kay . people also had certain frustrations , that I think that we could try to take into consideration with our design . That being people k um frustrated with losing their remotes . I think over , fifty percent of the people mentioned that that was their biggest frustration People . are also frustrated with the difficulty it is"
sample_067,19.93,19.65,4004.9,4024.55,67,"Okay like , bike . handles or or anything that you've seen like that The . inside is hard I . don't think we need to worry about protecting Ge o the circuit board I , think that that's done for us . Okay 'Kay . Yeah . . So we uh we do want latex . Yeah . Yeah . Okay . Latex Um . and"
sample_068,43.08,42.91,4592.33,4635.24,180,"to lose but , , but we don't want it to look like a kids' toy . yeah . Now that was one thing that we brought up over email . I don't know if you picked up your email Yeah but , . um the f the um feature that we considered for it not getting lost . Right . Well we were we were talking about that a little bit when we got that email and we think that each of these are so distinctive , that it it's not just like another piece of technology around your house . It's gonna be somewhere that it can be seen Mm-hmm . . So we're we're not thinking that it's gonna be as critical But if it's like under to have covers the loss or like in a couch you still It's can't really see it . Would it be very difficult to um just have an external device that like I dunno you , tape to your to your T_V_ um that when you press it you ha"
sample_069,17.61,17.42,1535.12,1552.54,66,"new remote ? Well but why are we why are we aiming for a technological advancement ? Everything we're talking about is ease of use and simple and that doesn't necessarily mean Mm-hmm . more technology , in That's fact a good it thing could to use keep in mind it could . mean not , . If they might be overwhelmed with with remotes that"
sample_070,49.54,48.73,4373.28,4422.01,175,", the menu with the other features and pro possibly also with your T_V_ channel choices shows up and , you have your five presets down here . Um if people wanna grab hold of that , see how it feels in your hand . That's our number one prototype Um . do you wanna present the potato like a little or , lightning shall Okay I present in it the Martian . ? , um The little lightning bolt in it What , very cute . We call that one I could the rhombus uh , The v the rhombus the rhombus That's rhombus the rhombus , yep Um . ? . this one is known as the potato , uh it's it's a how can I present it It's ? an ergonomic shape so , it it fits in your hand nicely . Um it's designed to be used either in your left hand or or in your right hand . Um I've gone here just for just for four buttons on this"
sample_071,42.03,41.82,1181.96,1223.78,76,". . I'll think of that every time now . It's Yeah gonna that's , stick a good in your one it'll head stick . with you . Mm 'kay . Um I have nothing on my screen . Just a sec . Mm . Here we are . Ooh no , signal Okay . , yeah , it's fine . Okay requirements , We . have a couple new requirements that I was just e-mailed"
sample_072,21.96,21.7,4683.16,4704.86,86,". Getting lost Um . we so we do we've decided not to worry about that for now . Okay 'cause well , the designs are very bright , so you're right they're , gonna stick out but , um So d do people have a preference as far as feel and functionality ? Um . I feel like this is simil or it's sort of what already exists so if we're trying to think of something sort of like new and fun , even though"
sample_073,15.19,14.51,6348.8,6363.31,59,"very decisive person so , it helped to have people say this needs This to is Yeah be what done . we'll do . in five minutes . I found that we did we could have used another five or ten minutes sometimes Yeah for , Especially some in of the the meetings meetings last . , yeah ."
sample_074,43.54,43.2,932.36,975.56,134,"all the elements to make that done . So wha the easiest thing to do is to break down all the points at which you need something to happen . So you make a schematic of the way that the the energy is converted tsh towards this practical function . And then I think the easiest thing to do is gonna be work on each task separately So . um Uh You just press yeah just , Uh . click . That'll . be fine . So the findings that I got uh very just very briefly is that you have a choice of the way that the information is projected to the receiver and in my opinion infra-red is the best way to do that 'cause you don't need a sight line ."
sample_075,39.74,39.6,2311.72,2351.32,129,"guys I uh had a lot of fun doing it . Components design . This is where you look at what does it take to make a remote control and what should we make our specific remote control out of . Um . So , we need to examine each element separately , but we're designing a full thing , so you wanna keep it integrated as a whole . The main elements of remote controls in general , and therefore ours as well , are the case , the buttons , the circuit board with the chip and the battery . These are all things that we had sort of addressed before , but I'm gonna take each one a little bit separately here as we figure out"
sample_076,40.52,40.43,769.11,809.54,126,"remote control is a device that's simple , it it's easy to use , uh it's got big buttons for doing the things I do most often , changing the volume , changing the channel . It it does everything that I need it to uh , as I said before , I'm quite lazy , I don't wanna walk across the room just to adjust my television . I also want something that that looks cool um , and that that feels good , that's ergonomically designed . Mm 'kay . Thank you very much . That was very useful . It's funny to see the drastic difference between those two remotes Hmm . Um . . And neither of them were very pretty ,"
sample_077,41.99,41.62,6267.45,6309.07,128,"discussed how the how the buttons might work Mm-hmm , um . Yeah . and how we could like improve on the on the design . So it was a bit of both really , we just kind of started out by each taking a colour of clay and just fooling around with it and I came up with that rhombus shape and he came Mm-hmm up with the . sort of potatoey , mangoey shape , and then just went from there really . Cool . It was fun . So well done with the management , I felt well managed . Oh thanks . I think we did well in It's kinda fun first . of all giving our meetings the time and , second we"
sample_078,17.59,16.42,5946.27,5962.69,62,"least be c p creative enough to think of toggle switches mm I etcetera . I am really into the idea of kinetic batteries now Oh I'm , after so reading excited about them . Yeah . That , I didn't was even know they existed I . I knew you can get watches that had them , like really quite expensive"
sample_079,27.55,27.27,1748.35,1775.62,108,"lazy people , who can't even be bothered to pick up the remote . Yeah . Mm yeah . Maybe I I mean if I get m more numbers I'll , e-mail you before the next meeting in terms of ages . But this doesn't divide up anything and there was only a hundred subjects also Mm-hmm Mm-hmm . . , which isn't , I mean , really isn't that representative , especially if it's a hundred subjects that th they then can subdivide into age groups that means there's very few in each age group , so Yeah , but I th I think regardless we're we're"
sample_080,19.06,18.1,4473.96,4492.06,83,"Um not really , it would make it hard to turn Mm-hmm the machine . off to , turn your T_V_ off . If you pressed and held it maybe . Yeah If you like yeah held , that it down that'd be one Yeah way of doing . it , yeah , that would be . That'd on work On off . off that's , , yeah a possibility . , yeah . Okay . And then finally we have um the"
sample_081,45.21,44.61,5538.85,5583.46,198,". It's very curvy , so okay Yeah I never did get a picture of those . so I don't really know . Our case material supplements oops we , just skipped Well by don't them we need plastic and , No . , we we the plastic is the plastic for the inside is assumed Provided The . , okay supplement . is The wood Oh , I ? guess it was rubber rather I mean than It was the rubber latex rubber and special . . colour , right ? Yeah . Mm-hmm , okay Do we have . more than one special colour ? Yeah Uh we're , using well we're gonna Special colours need at least isn't , two it ? special colours . Um . I don't know what Per the se the basic colour I is dunno though where it . yeah . Well but , we know that we're having at least three colours So so , let's y say Well three , are we talking . about on each colour combination or are we , you know , we'll like we'll have yellow and black Is . that two special"
sample_082,36.82,36.26,3763.31,3799.57,136,". Yeah , I mean , it would t totally take care of our problem of not wanting to change batteries . Yeah . Yeah um , I think it's good as , as long as we consider the the cost and the uh how reliable it is , but Right as far , I haven't as I know gotten the , technology any is good . Costs yeah . any , more information on cost other than it's more expensive than a regular battery , but um But over time but if we're using a an i a cheaper chip , then it'll even out , I think . Um circuit boards . Um yeah , I got a whole bunch of information on how circuit boards are produced They're . they're thin fibreglass with"
sample_083,26.58,26.49,3589.82,3616.31,83,"but , doesn't have the four on i like Oh yeah around you , had it one , I don't of the think in-between . ones , when they weren't doing that anymore . Ts Right and you press . the centre button , that's that's Oh your all-purpose I , see select right , yeah , button right there . Oh . , okay Since it's the . Yeah one , that's in the quite centre a good that's design not ."
sample_084,17.22,15.73,631.33,647.06,47,"people But . I think within that there is also room for us to introduce novel ideas uh and to make something that's that's perhaps a little bit different , something that stands out . Um also in in designing the user interface we need to consider"
sample_085,25.88,25.87,6080.99,6106.86,105,"take a master's class ? It's really funny that you got spam in your work emails Yeah . , but check it out So . like there are all these like links they , don't go anywhere . But all that you need to keep in mind your knowledge management Um . just wanna make sure you do . No the first one that you sent like I didn't realise that it was a joke and I was like why did she send this Oh to us ? It's very it's very work relevant , 'cause people It is send spam . a lot ."
sample_086,26.38,26.1,6102.75,6128.85,107,"very it's very work relevant , 'cause people It is send spam . a lot Yes . definitely I'm very sad that I didn't get any links to the corporate website . Oh here . you can Let's see you can , what view did I get through . the corporate website It's ? You can just just see what's inspiration up . about circuit boards . Wow . Yeah it's it's really deep Hold . on . Takes a little while to get excited to load . That the Excel thing is pretty cool Yes Yeah that , . Here . I is love , pretty"
sample_087,40.54,39.82,4291.58,4331.4,109,"we're , gonna need a scroll um , we're choosing a latex case w in fruity colours that's curved and um we're using push buttons uh with a supplement of an on-screen menu . And it sounded like we had set um like eight or nine buttons , including five pre-set channels . Okay Let's ? do the look and feel design presentation first . Right , do you wanna start ? Right well , we made three different prototypes and I guess we'll start with with this one . Um we have our colours not are not fixed , but this is the general shape . Um it's"
sample_088,37.31,36.73,2367.19,2403.92,132,". I haven't seen any pictures of what this exactly looks like yet , just keep that in mind but , these are the options that we have from manufacturing and we can make our case out of plastic , the m the main base will be plastic but , we have all these sort of fashion and technological elements we can add in , wood latex , , titanium , rubber or other coloured types of plastic . That would be our case Um . buttons , for buttons we have um pushbuttons , which is what Real Reaction uses the most often but , we also have scror scroll wheels which , can Mm have integrated pushbuttons . , or we could go all high-tech and have an L_ L_C_D_"
sample_089,46.05,43.86,4920.49,4964.35,138,"on a scale of one to seven with one being really extremely true and seven being not true at all , or false , if the remote that we've created conforms to the following criteria So . we can do this one first . First we wanna know if it meets the fancy look and feel um objective . So like in my opinion the for now at least , the yellow one is probably somewhere in the middle so I'm gonna say it's like a three That's . just my opinion . Yeah . What does each of you I I kind of think it's it's unique enough that I'd give it a one or a two . Okay well , give it a number Okay , sorry . . I will give it a one ."
sample_090,31.53,30.08,6080.37,6110.45,124,"else wanna like take a master's class ? It's really funny that you got spam in your work emails Yeah . , but check it out So . like there are all these like links they , don't go anywhere . But all that you need to keep in mind your knowledge management Um . just wanna make sure you do . No the first one that you sent like I didn't realise that it was a joke and I was like why did she send this Oh to us ? It's very it's very work relevant , 'cause people It is send spam . a lot Yes . definitely I'm very sad that I didn't get any links to the corporate website ."
sample_091,19.19,18.87,6012.36,6031.23,94,"If . we could choose more than one , that would be my second choice Oh , that . would definitely be my second choice . Mm . Although the tog toggle I'm afraid That's I cool would Let's . I all would break let's all it go for It's the cool yellow . I would break it I . think . I would break it It . Break started the stem because off . I wanted to have it as st as a stem and then alright , so Oh that's funny ."
sample_092,39.96,39.18,5285.99,5325.17,157,", but you'll have it afterwards Mm-hmm . . So I'd I think I'd give it a two I guess . I think it it's probably a little harder then most remotes to learn , because you have to you have to use the menu system and you have to tell it what your favourite channels are and Oh that , good could point take . a bit of learning at first Mm-hmm , but . once you've yeah , once you'd learned how to use it I , think it is a lot easier . So I'd I'd give it a four Okay . . I think I'd give it a four too . It's a pretty high learning curve it'll , be easy once you've done it , but Mm-hmm Yeah . . Alright um , also earlier we had something about losing it and so now we're not addressing that at all so ,"
sample_093,41.63,41.28,4351.59,4392.87,133,"at the tip , very visible , very big . We have our up and down buttons , which are also gonna be our channel selectors , and we have our little menu button here . If you push if you're just pushing these normally they're , the menu buttons , if uh the volume buttons rather . If you press select once , they become channel changing buttons If . we press select three times , the menu with the other features and pro possibly also with your T_V_ channel choices shows up and , you have your five presets down here . Um if people wanna grab hold of that , see how it feels in your hand . That's our number one prototype Um . do you wanna present the"
sample_094,34.64,33.8,570.36,604.16,85,"does uh , how it works and , what the end-user is gonna want from this product . Um . Oh a , way I'd suggest that we could go about this is by designing uh several different prototypes of user interfaces for this product um , and then uh trying to get some feedback uh about h how well these particular prototypes work , uh sorta find out what people think of 'em . Um using a remote control is is quite a subjective"
