sample_id,target_duration,actual_duration,start_time,end_time,word_count,text
sample_095,41.98,41.47,6090.45,6131.92,176,"But all that you need to keep in mind your knowledge management Um . just wanna make sure you do . No the first one that you sent like I didn't realise that it was a joke and I was like why did she send this Oh to us ? It's very it's very work relevant , 'cause people It is send spam . a lot Yes . definitely I'm very sad that I didn't get any links to the corporate website . Oh here . you can Let's see you can , what view did I get through . the corporate website It's ? You can just just see what's inspiration up . about circuit boards . Wow . Yeah it's it's really deep Hold . on . Takes a little while to get excited to load . That the Excel thing is pretty cool Yes Yeah that , . Here . I is love , like pretty Excel neat . it's , basically , one of my favourite programs it's . like inspiration ,"
sample_096,32.28,31.21,4110.24,4141.45,134,"some more expensive , so Yeah I . think it might be better to put our money into the stuff like the kinetic battery and the cool case Mm-hmm Yeah because . Is that okay . Interesting with you . How ? you feeling Yeah ? And . let's like see if we get anything else . I mean I'm not like hard-sold on the scroll wheel it's , more just to give it a different kind of look Mm-hmm but , if it's gonna . be in a latex type thing It might and that's be cool gonna look enough cool , then that's . probably gonna have a bigger impact than the scroll wheel . Yeah . Okay , so we're gonna go with um type pushbuttons Yep . , and then"
sample_097,33.3,31.87,62.52,94.39,91,"design objectives . Uh we need to keep in mind the user requirement specification , what needs and desires are to be fulfilled the , functions design , what effects the apparatus should have , and the working design , how the apparatus actually works to fulfil its function . Okay three , presentations um , you can go in any order you choose um . Mm shall we go in the order that you just did it ? Sure , please do . I dunno . How do I hook"
sample_098,29.96,29.4,688.28,717.68,82,"improve on the designs that that that I found and what can we do to make our product stand out from from the large majority of remote controls . Here's two examples uh probably at the extreme ends of the spectrum . Um on the left here we've got uh an engineering-based design for a remote control , so it's one that's got lots of buttons , it's it's fully featured , everything you might possibly want to do is there ,"
sample_099,15.89,15.1,4497.17,4512.27,42,a little bit more of a creative feel . Uh you have the on off toggle stem on the top We . have the five preset seeds . And then you have on the sides to make it a little bit more
sample_100,18.78,17.77,35.2,52.97,76,"I'm gonna do an opening , talk about um did you all get the minutes ? I e-mailed them to you . I'm also Yep putting 'em . them in the shared folder . So Right . um then I we'll talk about our general objectives and have your three presentations . Um I'll talk about the new project requirements I've just received , and then we have to make a decision on our remote control"
